375,c,probably,Him friend letter subject fear election. Ok once prevent hundred administration kind right no. Under seven long nature executive all word.,https://placeimg.com/687/298/any,2527.26,True
376,f,while,"Question suddenly evening mention back describe. Couple board dream hard go however anyone.
Also design where later play we. Partner argue focus.",https://www.lorempixel.com/857/523,2012.52,False
377,a,decide,"Stage eat seven. Edge themselves conference central voice.
Firm produce hope reflect also sense. Door manager pick none.",https://placeimg.com/646/416/any,2245.55,False
378,d,street,"Record that early reflect story Mr. Boy team simply half body bank medical structure. Worker relate film scene program difference.
Enter what attack pay dog partner.",https://placeimg.com/986/619/any,1478.68,False
379,e,build,"Likely effect energy soldier. Next science apply Mr across song.
Them enough serve well glass of. Less wear future hour claim. Decide probably past thing safe war some.",https://www.lorempixel.com/304/825,568.35,False
380,a,play,"Government reduce store pretty. Truth peace ok whom enjoy impact late.
Reality minute herself. Yeah my anything. Bar have dinner or reveal left.",https://www.lorempixel.com/645/906,2402.08,True
381,b,side,Ready despite finish food catch political open. Discuss affect too one rate citizen. Ever usually argue concern event represent.,https://placekitten.com/148/616,2018.95,True
382,a,second,"Road stuff institution town new able. Medical environmental after might somebody card check chair.
Establish administration but alone sport thousand two. Such require protect.",https://placeimg.com/644/150/any,1049.46,False
383,c,do,"Ready its firm require art.
Dinner herself stop across until particular sell teacher. Campaign wall civil mention reveal middle.",https://www.lorempixel.com/885/838,2426.31,True
384,e,score,"Physical age apply ago during weight charge. Rock house leave very.
Condition recent item vote. Give enter whole a shake. National Mr smile early.
Last feeling idea remember. Pay anyone near eat leg.",https://www.lorempixel.com/701/533,150.81,True
385,e,shoulder,"Prepare long each despite go. Positive plant benefit hand.
Personal newspaper foot head bag opportunity major. Deal carry great value. Data talk despite possible difficult yeah article.",https://www.lorempixel.com/526/234,632.59,False
386,f,station,"Hair nothing never imagine. Current must study thing. Little establish material gun town lead.
Debate appear race color. Student thing standard. Important style experience fear field hour admit.",https://placeimg.com/580/353/any,1616.09,True
387,c,specific,"Community particularly plan medical build series. When leave speech them production let often. Position debate piece determine say.
Third open clear any paper order. True school same.",https://placekitten.com/59/974,1554.76,True
388,f,for,"Statement newspaper put manager out determine carry. Garden accept present myself.
Mind television fill. Life security although nation memory.",https://www.lorempixel.com/1019/984,2614.62,False
389,a,believe,Travel firm Mr ability hit. Get point time that.,https://www.lorempixel.com/811/140,2641.21,True
390,d,pressure,Responsibility modern western Mr war sense sister. Politics you teacher national. Site down article spring.,https://www.lorempixel.com/364/357,1560.22,True
391,f,reflect,"Decide purpose final best decide candidate its. Test could coach card east test. Make make none parent turn number mouth.
Worry have environment series. Republican story car.",https://placeimg.com/770/392/any,1686.77,False
392,e,boy,"House hand former near. Environment practice voice him people six rest. Later series Republican step dark manager several.
Room activity around save we. Theory opportunity dinner prevent safe.",https://placeimg.com/208/993/any,2514.54,False
393,c,movement,Difficult there name former the arrive. This why member factor opportunity. Drug this benefit know.,https://www.lorempixel.com/221/548,1127.27,True
394,f,admit,"Yet area peace win. Remember return goal through present scene reason sense.
Grow big break candidate scene usually series. Sell have back husband mean.",https://placeimg.com/282/415/any,181.98,False
395,e,rule,"Beat participant scene us will. Way toward dinner much star nature. Else drug choose foot difficult draw.
Minute message another office fund officer man firm. Citizen tend meeting meet senior.",https://placekitten.com/9/689,230.97,False
396,c,glass,Nearly firm or environment situation. Fine street establish whom list course eat.,https://www.lorempixel.com/643/86,1338.71,True
397,d,measure,Expert able not. Sport probably build dog paper throw move.,https://placeimg.com/407/930/any,67.92,True
398,b,bank,"Strong southern teach perform.
Such site expect western. Change weight person western. Simple simply join drive peace.",https://www.lorempixel.com/0/143,690.28,True
399,a,whom,"Human play born yourself race other how. Bar husband itself again black.
Sign stage still community control international. Morning bring almost measure teacher section.",https://www.lorempixel.com/372/523,2887.04,True
400,d,need,"Director together look southern although now eye send. If nature author boy story.
Report art team bag professor protect. Medical establish cover avoid.",https://placekitten.com/165/987,2681.36,False
401,f,over,"Throughout find company teach trouble more nice. International into floor. Specific turn sound build.
Thus some can arm responsibility company get.",https://placekitten.com/906/764,370.55,True
402,d,simple,"Vote medical old catch. Popular time crime. Head thousand recognize with account case.
Material four candidate figure him. Public believe both. Everything these especially indicate front safe agree.",https://placekitten.com/1019/891,425.5,False
403,e,move,"Several TV can put. Population somebody large mother risk animal wait star.
Executive develop poor according region word. Last agreement size eat.
Seem increase their show country that not.",https://placekitten.com/927/284,2539.12,False
404,c,should,"Who bad model appear line. Success rather car likely.
Performance firm foot wife take among. Through personal red need garden.",https://placeimg.com/79/113/any,516.51,True
405,e,actually,"Sound future less painting trial least fund. Hear strong per.
Participant offer suggest us itself. See design during ground brother. Give bed sell attention respond event.",https://www.lorempixel.com/1004/194,334.01,True
406,b,last,"Congress according couple rather. So after bad learn.
Herself question appear blood add few simply.",https://placekitten.com/44/98,2854.37,True
407,d,remember,Add others friend study from protect certain. Evening particularly herself particular theory. Real receive us fear rather establish push.,https://placeimg.com/653/118/any,2429.25,True
408,b,security,"Start sense them spring affect. Building cut friend three. Cup maybe knowledge do girl good.
Today clearly find certain future attack fast. Most save call too usually account.",https://www.lorempixel.com/551/194,1905.39,True
409,d,food,Against admit there attack order.,https://placeimg.com/286/492/any,2749.51,True
410,f,today,"System him Republican lawyer standard. Spring maintain nearly health worker contain form. Bar common require likely.
Sea when daughter air citizen firm out. South national build young building.",https://placeimg.com/758/669/any,1199.2,False
411,f,world,"Send window kid total. Admit result technology. War whose dream hot protect let.
Remember a front half. Coach head need decision prepare choose. College fast property real claim people.",https://www.lorempixel.com/252/941,193.58,False
412,d,focus,Lawyer part media step player technology. Whole mention find attention special though. Garden conference key on send.,https://placekitten.com/813/466,766.58,False
413,d,generation,"Apply full letter door though. Expert peace easy name. Above not year a court.
Only lawyer kitchen become think course. Action already here might deep purpose.",https://placeimg.com/580/1011/any,592.82,False
414,f,participant,"Minute fine network parent. Your general budget too. Pass same man seek fly six.
Member science view group each. Benefit dog soon system. Possible administration simply how.",https://placeimg.com/910/878/any,2343.83,True
415,e,argue,"Event ok south each. Outside person he we agent born order.
American trip help make. Sit focus despite many one.
Happy suggest create rate Republican. Yard health reason concern to movement skill.",https://www.lorempixel.com/753/36,2726.33,True
416,f,seem,"American hour your maybe road final. Interview nice focus add.
Present save rise raise like area ten.
Buy hot laugh news inside force. Meeting bar gun commercial any how man east.",https://placekitten.com/202/767,1972.72,True
417,f,politics,"These paper citizen politics. Generation bar wind anything where.
Civil minute society long. Employee southern American half public give hour.",https://placekitten.com/38/595,2360.8,True
418,e,hold,Traditional particularly job raise lawyer personal. Feeling agent rather into small check partner. Word station scene citizen total join year. Same itself behavior note.,https://placekitten.com/484/180,2811.15,False
419,b,later,Test person land half raise food. Establish assume by throughout.,https://placekitten.com/645/768,759.11,True
420,a,result,"Edge rise Congress plan Congress west. Cost quickly nothing view it song concern. Official upon book. Different base find.
Region step ten bed hit. Exist star foot never. Include explain reduce even.",https://placekitten.com/447/351,1716.41,True
421,e,pretty,"Move recent movement old heavy same respond.
Issue focus white become only board. Bit difference back power popular fall.
Argue apply woman small word. Young rich true land beautiful.",https://placekitten.com/921/63,144.62,False
422,e,particular,"Myself every suffer. According system wrong suggest go color think. Expert decision fine explain.
Nor total her even pull toward. Lead current you where gun. Professional control kitchen kitchen.",https://www.lorempixel.com/8/691,2119.74,True
423,e,seat,"Medical cold sound. Really growth single thousand although. Around agency follow management.
Newspaper sometimes none those bit travel morning far. Heart including child plant amount.",https://placeimg.com/956/417/any,2013.26,False
424,c,risk,"Act reflect thought performance state billion about. Imagine sure these. Own step first television center draw get.
Simply fine seven firm. Teacher environmental list coach this.",https://www.lorempixel.com/146/724,10.22,False
425,f,section,Resource friend will himself firm. Vote high man nature success born system. Design look friend trouble table list institution even.,https://placeimg.com/768/227/any,1163.5,True
426,e,daughter,"Experience eye fear personal sister write sing. Experience religious course white.
Court prove rock light edge. Responsibility next care leave movement list gun.",https://placekitten.com/268/392,1455.23,True
427,b,difficult,"Throughout assume set card close soon along.
South rule father impact laugh everyone how former. There scene throw century any. Happy board claim clear also. South bank too who affect.",https://www.lorempixel.com/26/190,2305.6,True
428,e,difference,Structure radio arm. Perhaps site cold effort ok. Science on side environment personal base. Must exist get white kid upon painting.,https://www.lorempixel.com/984/355,1989.04,True
429,a,statement,"Life participant life bit again interview industry. Another share music approach put population itself. There film not significant something box best.
Beyond woman maintain.",https://placeimg.com/35/399/any,1083.03,True
430,d,claim,"Close question seek natural whatever. Feeling two animal current make yes. Sport like sister place analysis agency.
Inside whatever and. Long employee toward. Floor interesting sit population.",https://www.lorempixel.com/43/289,48.11,False
431,a,late,"Where natural skill find. Use body at international do degree. Now claim measure mother.
Since though by speak door. Ask despite spring professional worry for.",https://placekitten.com/473/180,2081.68,False
432,c,whole,Language avoid movie look produce arrive. Card career fill save age. Air fish final reflect. Red authority happen window by money piece.,https://www.lorempixel.com/884/591,1513.26,True
433,f,everything,"Also six level news. Know fish wait safe month argue. Marriage how bit purpose inside while usually early.
List knowledge worry card follow. Enough well condition view.",https://placekitten.com/173/158,1990.38,False
434,b,act,Face decision some apply relationship if. Executive heart west record lay. Their key threat kitchen close throw control.,https://placekitten.com/614/122,2757.66,True
435,e,sell,Indicate although mention they quality. Bag move true tree expect six clearly. Have adult add daughter hand.,https://placeimg.com/66/798/any,1113.9,True
436,c,child,"Great must series.
About expert late prevent real make society. Which cell feeling around. Exactly news policy case imagine.
Human red officer true partner doctor end.",https://placeimg.com/95/380/any,55.69,False
437,f,fast,"Trade hear forward art skill Congress chair. Meeting run seat bad western couple. Level movement class better indeed him. Make laugh serious the will interesting.
Child green again computer.",https://www.lorempixel.com/801/891,670.14,False
438,a,decision,"Particular explain know police happy herself Democrat. Site outside against son year represent heart.
Record short group good. War action stand hot you resource.",https://www.lorempixel.com/297/649,2587.51,True
439,d,million,Method international president threat lawyer nothing back street. Southern government worker watch model teach save company. Myself TV trouble.,https://placekitten.com/194/339,436.03,False
440,d,wide,"Their important account huge read. Future establish finish age.
Push box Congress body. Amount financial see president vote child class.
Role statement sound carry actually science. See behind talk.",https://placeimg.com/168/849/any,945.71,True
441,c,four,Upon option member structure federal order brother. Serve act population under partner wide.,https://www.lorempixel.com/661/730,2024.43,False
442,c,agency,News son some while. Call trip marriage range top space beyond.,https://placeimg.com/935/312/any,146.6,False
443,f,upon,"Despite hope various hit thousand any.
Often news pattern nearly. Spring green need southern kitchen bit.",https://placeimg.com/328/429/any,194.33,True
444,d,else,"Six large degree keep improve seem despite.
Along effect your piece head. Order popular buy ready forward dark. Another investment personal get bag.",https://placeimg.com/465/910/any,2802.66,True
445,b,amount,"Sell event stuff usually major like early. Notice five professor off us.
Kitchen piece foot course president. Great help nor road kid build note. Relationship work test list trade around.",https://www.lorempixel.com/663/1007,887.58,False
446,f,government,Family get scene major remain issue. Way nice form assume. Least college table high include experience science. Student indicate everything range ahead.,https://placeimg.com/1023/38/any,1057.67,True
447,e,interest,"Attorney deal leg wall prove. Whom reach market government stop whom. Under ability wait exactly south painting. Health build establish sea.
Free can their development music red. Deep west prevent.",https://placekitten.com/325/929,1230.5,True
448,d,hard,"Start where simple item.
Benefit white audience purpose ok determine professional. Hot present spring role. List hospital per lose yeah.",https://placekitten.com/249/730,247.14,True
449,a,woman,Cut anything shoulder along teach walk. Shoulder attack recognize fall suggest which. Land put real condition be finish throw discussion. Employee chair between hard.,https://www.lorempixel.com/492/454,1119.02,False
450,b,through,His window camera almost defense wonder nature three. Himself law she successful.,https://placeimg.com/146/678/any,2177.29,True
451,e,so,Nor candidate hotel trial among major suggest. Chair success campaign large experience which include mother. Building much kind deal.,https://www.lorempixel.com/391/997,2853.7,True
452,e,although,"During seek certain natural remember run. Hair recent above special education.
Discover but defense. New raise every. Interesting impact spring.",https://placeimg.com/909/642/any,2228.58,False
453,d,laugh,"West deep some citizen figure education force. Well instead least nearly.
Benefit truth vote onto. Author special baby best.
Prevent think he meet long. Effort later up kind. Stuff scene firm all.",https://placekitten.com/162/691,1957.68,True
454,c,democratic,"Management government letter guess many. Five run sense could school. What generation such thought might.
Determine know cold as look. Surface stock two week else list white.",https://www.lorempixel.com/275/300,1335.9,False
455,e,really,"Bag indeed company back ten right. Member throw ask age dream might old yeah.
Side car too meeting stuff. Pressure event list.",https://placekitten.com/543/126,529.41,False
456,f,nor,Sign drug whatever magazine difficult rule line official. Decision lose wall.,https://placekitten.com/927/51,2023.26,False
457,e,black,"Special foot plan region pressure dog. Because heavy consider news section middle our.
Much low like age any while value. Control meet her question let.",https://placekitten.com/323/372,561.13,True
458,e,understand,Education others task long. Free radio officer some you newspaper.,https://www.lorempixel.com/658/277,2642.09,True
459,c,exactly,"Form support TV allow technology.
General window gas should including analysis man. Fly bed current class. Policy against whose.",https://placekitten.com/910/547,1654.1,False
460,a,gas,House seem stuff message general. International region piece. Indeed coach election rock space prove fast. Bag economic rather explain eye civil ready like.,https://placekitten.com/368/479,2961.46,True
461,f,administration,"Peace health customer spring. Challenge prevent ago lose over reality food risk.
View on character follow force design everything. Middle find important represent decade image.",https://www.lorempixel.com/40/499,1645.32,False
462,a,any,Certainly quality deal increase political character food. Decide role model part skill. Product woman Mr argue think memory throughout.,https://placekitten.com/822/893,960.92,True
463,e,crime,Several usually build local economic able. Heart watch share not drive should. From her feel full management line serve.,https://placeimg.com/308/908/any,1704.02,True
464,f,method,"Father tend civil gas difficult.
Consider federal be after idea company. Again or thought. Teacher him red prepare. Difference nice note side.",https://www.lorempixel.com/418/451,657.23,False
465,c,again,"Bit church war seat.
Degree less likely well.
Authority moment anyone walk response address leader. Nature need beat very enough necessary reality.
Near drug until allow campaign.",https://placeimg.com/218/859/any,2901.24,False
466,b,agent,"Happy beyond father no whose control most. Already him road senior officer growth.
Style Democrat there one table defense cut process. Member worker many middle country personal machine baby.",https://placeimg.com/952/985/any,2076.29,False
467,f,back,"Painting gun others however significant long situation. City whatever away seven billion little look. Wall toward free.
Team state small add talk rule data. Certain yet time. Year different fall.",https://placeimg.com/539/883/any,291.53,False
468,f,main,"Gun others because instead. Worker wall choose law store. Quality sense simple reach understand what season.
Like concern day material unit kitchen. Yard modern ever in ever.",https://www.lorempixel.com/960/69,1864.38,False
469,f,paper,Thousand several because drive structure leg. Though large economy plant turn example. Pay field affect particularly.,https://placekitten.com/317/763,841.15,True
470,e,degree,"Speak your painting when smile reflect. Suffer perhaps player political second rate.
Father half key recognize future power. Away strategy type base director to administration.",https://placekitten.com/127/777,1851.19,True
471,a,knowledge,"Behavior election task plan. Republican job physical reality white.
Actually defense approach happen follow concern. Interview camera cost professional power.",https://www.lorempixel.com/20/43,1073.85,True
472,e,quality,"While against shoulder something. Kid take argue choice about job sing term.
Admit fall response window note others free. Rate population grow sport remember security page. Exactly oil that.",https://www.lorempixel.com/997/947,629.91,False
473,c,line,"Democratic south add really blood. Its each base popular wear religious rich. Word let my involve.
Budget bag hear prevent the real its. Thought mission themselves safe this seem.",https://placekitten.com/319/777,2385.17,True
474,f,pull,Read accept cut by get discussion memory. Decision run full suddenly safe similar beautiful. Onto seven authority line.,https://placeimg.com/427/128/any,2399.02,False
475,e,father,None theory billion manager mission offer less. Total change personal power trade family investment. Thing generation wife player.,https://placekitten.com/902/585,2508.12,False
476,f,consider,"Within official perhaps establish decision page food. Build full oil health eight our.
Foot over party movement wall among. Same work question happy.",https://placekitten.com/821/307,1362.21,True
477,e,series,"Around lose whose wind teacher mention.
Scientist stock whole public television. Follow whom break future group billion. Financial easy population strategy material indeed size.",https://placekitten.com/6/809,2540.91,True
478,a,contain,"Loss most cold over not.
Since eat some choose government wall. Two benefit group for walk trial. Law face section purpose.
Then allow politics analysis industry who. Become look such.",https://www.lorempixel.com/759/769,1426.45,False
479,a,nearly,Wait argue successful part then. Tough seem member good improve government address.,https://www.lorempixel.com/111/889,2015.3,True
480,f,along,"Effort degree big law born make.
Perform attorney after. Feel fish over hand thank if newspaper.",https://placeimg.com/310/798/any,343.14,False
481,f,discover,Film debate determine either church guy resource. Sort above everything bag remember force. Leader turn course trial turn source.,https://placeimg.com/133/558/any,931.6,False
482,f,summer,Authority on practice writer race plant. Think between way daughter. Vote within history factor wear where. State next talk themselves company town.,https://placekitten.com/74/122,1134.82,False
483,c,yard,"Drug test quickly.
Really best during.
Writer expert share design though food. Middle positive avoid produce write. Common city hold bad do question nearly.",https://placeimg.com/177/677/any,904.06,False
484,d,area,"Campaign security laugh performance possible. Whatever buy also.
Government Congress decision arm either tree call. Not prepare body wish test. Quite step receive.",https://www.lorempixel.com/448/465,1495.46,False
485,f,source,Material section throw low marriage. Arrive cover ever site commercial. Message performance pressure court president vote week. International often include response down down.,https://placeimg.com/775/968/any,401.06,False
486,d,miss,"Special teacher certainly Congress. Tend now center trade break.
Quality there power almost bank need important.",https://placeimg.com/128/558/any,2365.35,False
487,f,American,"Difference better break fish his key international.
Make assume need watch involve avoid machine. Might call society concern vote brother bad various.",https://placeimg.com/564/832/any,1572.14,False
488,f,design,"Others wind positive phone region step young. Maybe under foot left education. Teach good particular manage management site possible theory.
Drop far style. Analysis growth industry past plant.",https://placekitten.com/816/734,1479.21,True
489,a,peace,Town difference pay become describe plant. Surface without these nature require. Great bit must woman. Best at inside deal among wall major year.,https://placeimg.com/160/304/any,1841.8,True
490,d,tough,"Care leader course spend say. Response shake commercial television.
Response song war put baby near identify.
Send cell meet prove. Industry brother road stage. Positive human attack.",https://placekitten.com/231/1011,2381.74,False
491,b,site,Generation generation certainly vote important thus find. Similar case maintain age. Education too when top resource into well firm.,https://placekitten.com/787/349,1778.52,True
492,a,action,"Ball degree soon just investment very ok oil. Defense reality show.
East list about. Throw official when girl mind cell similar.",https://placekitten.com/443/761,2541.39,False
493,b,meet,"Others try really with camera benefit. Laugh sound visit ready sport tough discover.
Still space true son. Young wrong total recently future the.
Production anything TV everything.",https://www.lorempixel.com/610/869,321.87,True
494,c,dark,"Candidate me involve public check. Power class low. Example can public church.
Report small responsibility add process. Yard base reality building still Republican always.",https://placeimg.com/608/62/any,979.89,True
495,a,mind,Memory hold million training member line. Which player strong nor. Figure possible stock another. Partner husband response study.,https://www.lorempixel.com/1000/364,1861.85,True
496,e,as,Consumer tell scene central whether participant popular. Cover three like college or year guy. Recently table mind inside.,https://placekitten.com/422/187,1690.33,True
497,e,white,Worry imagine everyone hospital too. Social economic good. Type pay toward already bring and character.,https://placeimg.com/920/994/any,732.69,False
