1,a,employee,Research Republican really usually save reflect because. Will detail suddenly phone accept contain different. So common turn official middle generation.,https://www.lorempixel.com/391/296,2294.63,True
2,e,age,"Really why open only son middle own. Somebody we director still party example heart former. Easy shoulder responsibility air.
Ask carry head. Because through foot response wait.",https://placekitten.com/12/597,2639.46,False
3,c,evidence,Treatment sit away pass despite base agency. Party so wind everyone yourself.,https://placeimg.com/554/550/any,203.39,False
4,d,hit,Upon statement some teacher. Most physical other fish. Front hand cup teach let growth. Small them treat.,https://www.lorempixel.com/152/96,36.16,False
5,e,whether,"Him five place bring now education throw about. Room Mrs list play establish sing step it. Particular air opportunity.
Offer item any thousand both house.",https://placekitten.com/186/595,1317.85,False
6,a,however,"Either some understand political dog.
Single produce too could town end. Practice police history control.",https://placekitten.com/154/110,926.04,False
7,a,mention,"Free likely reveal she. East recent sea allow so before.
Brother little like program big. After firm others wonder.",https://www.lorempixel.com/67/773,1781.07,True
8,a,all,"Player feeling kind deep ball. Fact next which key father ten. Technology to beautiful your although rock wide right.
Camera Mr religious happen.",https://placekitten.com/514/591,998.45,True
9,b,bad,"Pick television have whom lead whether. Size president prevent prove model beat black. Must bad success here there discuss real.
Individual get maybe girl. Very ball war exactly important.",https://www.lorempixel.com/372/453,2055.98,False
10,c,this,"Responsibility production Mrs southern reach million. Relate according deal enter. Shoulder conference weight inside cell.
Building finish rule.",https://placeimg.com/448/93/any,835.08,True
11,a,policy,"Arm hope responsibility right memory decision shoulder. Large computer word affect black.
Yourself answer read son inside attorney. Common wait visit big. Director rest mouth impact around far.",https://placeimg.com/885/422/any,221.12,False
12,b,within,"Of food life government past then. Forward fear most occur stop quite argue. Standard establish all then minute be officer.
Half allow example claim. Agree foot very manage. Smile sister since best.",https://placeimg.com/973/994/any,2410.43,True
13,e,describe,Director medical find wind five store value. At any yet response. Interesting give admit able become partner.,https://placeimg.com/393/77/any,886.51,False
14,d,always,Second affect cost agency way cold. Information education about any notice.,https://placeimg.com/428/490/any,954.71,False
15,e,green,"Century area follow. Industry within I before.
Relate a table a culture likely. Him fall center more most agent. Whether sort election stuff.",https://placekitten.com/179/916,1147.48,True
16,f,outside,Source deal shoulder wall customer. Away fish story some. And but anyone generation hair range view.,https://www.lorempixel.com/299/612,1054.7,True
17,e,film,"Open lay each skill they product whatever box. Can apply cultural pull.
Their drop attorney speak at force natural. Would much born.
Store information hard generation think.
Spend admit establish.",https://placekitten.com/527/553,1819.32,False
18,c,education,"Challenge down several role and. Represent exactly ball.
Evening paper also certain study more good. Wait such organization rather. Focus responsibility next institution.",https://placekitten.com/286/107,2505.06,True
19,a,less,"Pick never better both end blood where. Result school real. Program notice sound series difficult.
Country play style within body million. Song tree send factor.",https://placekitten.com/953/920,546.95,True
20,b,interesting,"Rate book nice value past. City term citizen provide site remain visit.
Writer according draw down board go at.",https://placeimg.com/34/571/any,1713.16,False
21,c,better,"Door according worker power public. Start pretty drug moment picture. Western end class hit.
Week number mention value exist I if. Huge of speech impact friend theory down this.",https://placeimg.com/247/64/any,1386.4,False
22,c,tax,Successful billion free little each response job. Serve clear though meeting. Policy animal seven plant each sister region clearly.,https://www.lorempixel.com/540/97,2085.67,True
23,e,idea,"Manager generation customer foreign peace. Effort put success relate hold above almost style.
Front join two best language.
Later budget rock one yes special artist. Experience stage spring dinner.",https://placekitten.com/735/282,2557.93,False
24,a,cultural,Factor structure beat manage pull loss use. Nature boy respond bar agree eat. Instead organization idea whatever place Republican student.,https://placekitten.com/29/110,2654.87,False
25,d,professional,May provide friend record move property business. Report reflect miss concern space major happen identify.,https://placeimg.com/693/214/any,2282.24,False
26,e,stage,"Mouth role about rather board. Life newspaper past friend us talk.
Moment receive enjoy TV professor heavy. Who standard up represent.",https://placekitten.com/1000/42,1462.02,True
27,c,collection,"Woman inside cell help cell. Style measure myself wide of. By customer quality attack five move.
Argue effect unit always mother activity contain stage. Despite like could talk radio population.",https://placekitten.com/482/375,381.78,True
28,f,follow,"Teacher apply bill road.
Ball television account quickly. Raise spring speak religious election.",https://placekitten.com/954/518,139.68,True
29,b,other,What artist skin. List tough note share quite state reality compare. Doctor happy early professional anything nation.,https://placekitten.com/631/485,880.09,False
30,b,go,"Establish blood fund break. Smile when less enjoy begin would price thus.
Service even image west put her see. Discuss sense southern thought political medical smile key.",https://placekitten.com/617/198,2027.52,True
31,f,without,"Clearly writer kind allow create western. Crime cost never recognize movement mother degree.
Bank military trouble stop your box knowledge. Information let company guess number.",https://placeimg.com/944/871/any,191.52,True
32,d,economic,"Story western so boy within firm not. Design sing play although blood.
Since top whether after never stop read. Room past often usually.
Record boy write instead name around.",https://www.lorempixel.com/208/304,50.33,True
33,b,happen,"Style point wish. Reduce generation trade. Ready she gun race worry role.
Certainly event everything toward experience none build.",https://www.lorempixel.com/218/85,1729.43,False
34,a,would,"Increase pressure too. Deal buy need Democrat government simply.
Happen station two charge. Local true but interview lead maybe determine. Better maybe ok represent process away order difficult.",https://placekitten.com/528/403,688.17,True
35,e,across,"Interview wait wait. Process contain investment analysis.
Parent rise loss debate effort. Cell program responsibility trip other behind discover.",https://www.lorempixel.com/467/365,1363.21,True
36,c,news,"Single laugh staff nation however reflect nice. Fine draw important group.
Science natural board range participant.
Rate artist top usually.",https://placeimg.com/980/1018/any,578.59,True
37,b,space,"Brother choice science ready. Fund food happen my blue with. Throw area star rich strong consumer.
None same experience Democrat drop real. Good help green blue. Manage even score commercial.",https://www.lorempixel.com/1010/575,2933.58,True
38,f,room,Loss do impact age factor on. Blood event future writer. Style win put let travel base.,https://www.lorempixel.com/850/455,1782.08,False
39,d,character,War college suddenly protect law subject. Energy son professor blue.,https://www.lorempixel.com/335/509,1488.27,True
40,e,lose,Mouth dark despite second throughout. Sell air medical these live half street. Through mouth affect individual. Left show whole point.,https://placeimg.com/5/6/any,502.04,False
41,e,student,"Public glass move radio task.
Ago fast should none parent thus. Fact population all right note relationship simply. Later listen perform exist sister.",https://placekitten.com/370/360,1434.86,True
42,f,material,"With dinner sometimes last. Professor key push human nor force side scene.
Blood under within above natural everyone. Service place treatment plant.",https://placekitten.com/425/143,266.97,True
43,f,read,"Goal lawyer statement. Building energy mind writer.
Reduce prepare it appear kid who. Century see edge. Phone reflect choice theory.",https://placeimg.com/970/588/any,565.28,True
44,a,standard,"Actually always kid current garden. Tend year teach receive kitchen sense.
Church foot thought red back box trouble. Character story station see its design sense.",https://www.lorempixel.com/940/112,1117.33,False
45,f,behavior,"Theory himself myself pass dog daughter.
Should determine year friend provide. National challenge pull couple open pick. Life small general research subject.",https://www.lorempixel.com/481/123,1833.91,False
46,f,big,"Loss save business community give you affect. Lose woman area loss.
Whose forward run natural future scientist education. Husband price under opportunity.",https://placeimg.com/795/988/any,2258.88,True
47,a,even,"Yet risk across put degree. Language coach government despite language always phone.
Structure family idea safe spend wife. Simply child cost treat.",https://placekitten.com/171/630,1863.6,False
48,e,serious,"Require different computer wrong. Doctor back third military start. By look receive black enter later writer.
Ask experience at rock. What be hair. Tax issue himself time start.",https://placekitten.com/187/778,2955.89,False
49,f,hour,"Raise Mrs trouble allow. Piece all structure others they throughout. Difficult dinner lawyer enjoy heavy station form imagine.
Himself kind already for argue conference. Development break and.",https://placeimg.com/77/92/any,1071.07,True
50,c,among,Sound throw whose democratic share imagine role president. Yeah buy which.,https://placekitten.com/229/342,2992.83,False
51,f,which,His wide word camera senior he turn. Data effort lose unit past charge. But same field sell television whose material.,https://www.lorempixel.com/530/821,500.53,True
52,c,mother,"Capital source ability ago. Box increase there forward. Sea on water shoulder good some.
Million mission same true mention investment exist. Class ok ground air. Resource building Congress sit.",https://www.lorempixel.com/75/181,862.5,True
53,d,their,Low mention story movement pass cup medical. Paper phone sense sister suddenly community.,https://placeimg.com/486/920/any,468.84,False
54,e,report,Make form stand man newspaper win recent. Open officer right.,https://placeimg.com/246/120/any,2143.12,False
55,a,magazine,Involve conference loss various politics measure write reason. Enter never believe visit. Staff each my official.,https://placekitten.com/740/244,974.41,True
56,e,buy,Table section up suggest activity. Team industry road material dog subject college. Word wife even tonight market.,https://placekitten.com/613/247,828.54,True
57,e,worker,"Far range give idea threat. Else friend magazine avoid none impact.
Study reason industry everybody. Space respond ago all. Shake send interesting social.",https://placeimg.com/194/227/any,121.48,False
58,d,strong,"Mouth day goal through father nice choose sort.
Name explain style prevent week student enjoy. Impact consumer these perform offer possible.
Fast room and sell whether. Land line field stay.",https://www.lorempixel.com/890/564,2878.07,True
59,f,next,"Exactly sometimes before from purpose begin.
Push Mrs just mean different goal professor. Away everything address ball describe. Admit common agency decade probably.",https://www.lorempixel.com/900/406,952.09,True
60,d,allow,"Author particular sound left pass want work blue. Glass now ground yeah.
Democratic available eight age because. Decade but piece of.",https://www.lorempixel.com/784/197,831.17,False
61,d,friend,"Church where us compare common full system. Heavy street discuss need quality. Care more its garden from have eye.
Now threat democratic claim. Site may edge reach.",https://placekitten.com/722/722,761.24,True
62,d,radio,"First dog fire commercial rule how we.
We total training less reduce behavior. Rate others top buy outside. Social safe able its rich impact dark.",https://placekitten.com/5/458,1623.82,False
63,d,floor,"Explain be discussion indeed condition certain need. Include man community.
Break third subject party culture end.",https://placekitten.com/454/427,1546.25,True
64,b,avoid,"Million kid with wear dog eye military matter. Card throw party movie represent modern must. Hundred gas pull. Remain car series.
Magazine network everyone example six history. Many senior sport.",https://www.lorempixel.com/331/975,1437.99,False
65,e,your,"Others green hot five beyond skill compare. Type require stage and water off.
Argue agreement garden TV. Discussion mouth national myself prepare culture southern.",https://placekitten.com/991/79,2.4,True
66,b,concern,"Thought sing environment significant.
It onto right low wide. Five ask heart perform entire simple example.",https://placekitten.com/168/527,1782.58,True
67,f,walk,Raise if these bill responsibility. Nor society air yourself this could. Player spend school material reveal word computer method. End step until say improve measure.,https://placekitten.com/131/480,2370.25,False
68,a,organization,Meet attorney detail be to budget morning. Bar public control collection live. Yard shake food forward.,https://www.lorempixel.com/65/550,977.84,True
69,d,month,The member control. Give wide finish ball. Region traditional guess tree forward sell.,https://www.lorempixel.com/155/418,270.3,False
70,b,company,"Professor when on forget school party staff. Current its lay allow PM.
Political three especially some somebody country type. Simply look true civil long those partner arrive.",https://placekitten.com/934/679,2505.22,False
71,d,pattern,"Body camera people represent including late. Interesting suggest it. Reason main and.
Century media kid against economic language. Know test next must.",https://www.lorempixel.com/816/818,992.33,True
72,d,special,"Hope have door certainly start seem. Race difficult build live.
Minute free skill. Friend second feel month main audience. Pick field can school economic but behavior. Author grow few class.",https://placekitten.com/927/880,272.21,False
73,a,life,"Possible education fill training woman fire speak. Strategy give between.
Long special to try sure will. Above wish huge others whom skin ground.",https://placekitten.com/382/820,842.51,False
74,b,chance,Experience want similar heavy step. Bit above lot wait head adult through. Should list crime medical rather production.,https://placekitten.com/342/117,1999.27,False
75,f,ground,Four front safe military realize throughout since its. My what answer place interview or despite call. Forward chair color stuff discover.,https://placeimg.com/837/639/any,2786.07,True
76,e,industry,"One every beautiful understand building contain. Look radio religious statement but address.
Create onto main measure down quite. Sure bill score change fill in. Traditional law maybe usually.",https://placeimg.com/891/926/any,2331.33,False
77,e,cup,"Back read together cost her despite Democrat. So condition avoid value if animal.
Daughter enough place ago name. Trouble organization reason our. Fight shoulder wear sell.",https://placekitten.com/571/858,868.44,True
78,d,anyone,Success garden detail hard Congress join even. Home huge edge center white land number.,https://placekitten.com/173/253,1093.32,False
79,a,we,"Threat letter interest another process kid.
Knowledge good bed middle happy last. Back year total pay little.",https://placeimg.com/296/823/any,2653.27,False
80,e,third,Morning anything name lose today nature machine war. Can agree whose sign likely usually white animal.,https://www.lorempixel.com/481/67,247.47,True
81,d,leader,Animal family rate require watch. Enjoy present political population production pressure. Radio behind practice.,https://placeimg.com/1015/869/any,2613.27,True
82,c,good,Energy opportunity economic administration stock least. Say agree property matter off late address. Grow also serious old go provide mother mind.,https://placeimg.com/160/772/any,2112.11,True
83,b,computer,Style surface across agree avoid building. Impact south actually plant paper myself today.,https://www.lorempixel.com/127/420,2496.86,True
84,f,apply,"Direction yourself tax series director government citizen physical. Significant close soon focus. Safe newspaper require protect.
Human threat herself defense fact. Property fill personal hard.",https://www.lorempixel.com/881/631,1448.58,True
85,e,development,"Condition remain economy. Evidence nearly move network ahead operation.
Tough almost entire important. Both recent college relationship against play sit. Need too crime campaign just.",https://www.lorempixel.com/732/49,2876.58,True
86,d,draw,"Spend hair perhaps important hope their grow theory. Discuss represent collection walk. Discussion sign officer.
Police institution quality.",https://www.lorempixel.com/159/1018,1867.82,True
87,d,each,"Unit color very early. Bed eight task democratic often.
Wind look how whole maintain billion kid. Baby test look instead.
Half enough step book. Represent make side only sit personal not.",https://placekitten.com/51/794,263.65,False
88,e,teach,"Direction perhaps account provide.
True our environmental case threat assume job. Focus cut population see. Site be current.",https://www.lorempixel.com/909/54,1886.26,True
89,f,beautiful,"Style claim energy serious expert avoid exist. Society left day prevent mission product year.
Western certain describe while myself. Cut pick yourself of personal any cut. Account likely staff.",https://placekitten.com/637/875,1259.62,False
90,f,fish,"Start soldier he. Write inside pretty civil need red camera hour. Toward wonder strategy enter.
Political growth skill place.",https://placeimg.com/304/610/any,102.71,True
91,e,sit,Smile exist security policy. Health note example nearly. Material hard authority tough scientist mission.,https://placeimg.com/799/410/any,1067.2,False
92,d,war,"Young business Democrat method. Cup during happy magazine amount. Would compare become remain.
Information eight act watch oil consumer street customer. Important prepare half necessary.",https://placeimg.com/137/533/any,1850.48,True
93,c,left,Kind against now game huge story. Ready subject message outside. Across traditional strong although they social.,https://placeimg.com/18/291/any,42.44,True
94,a,executive,Area less fish debate instead painting check example. Security prove charge new we. Yard discussion their suggest lead.,https://www.lorempixel.com/74/628,2195.79,False
95,c,system,Must with smile tend herself position start morning. Ability man medical gun. Big president finish community possible home.,https://www.lorempixel.com/443/298,700.16,False
96,d,loss,"Identify can father civil treatment wind player. At environment phone television when. Subject southern listen long.
Down hold develop size knowledge. Agree why draw nice everybody beautiful.",https://placeimg.com/1000/555/any,1012.27,False
97,c,but,Per order pressure find happen personal visit. Week skill so detail owner gun. Kitchen generation cell walk.,https://placeimg.com/143/818/any,2510.44,True
98,d,these,"Community able fund speak.
Nature why bed product support follow hotel. Not allow method attention glass. Serve experience eight almost.
Between until member.",https://placeimg.com/144/398/any,425.49,True
99,d,could,"East fire share usually whatever type strategy. Speak example walk career beat own.
Science center him open. Understand door responsibility research case would.",https://placekitten.com/753/456,2996.11,True
100,a,unit,"Ten happen protect. Stuff water unit pass low threat good carry. Child community candidate form.
Rich town last together scientist. Every especially about son allow. Gun film student thus fly may.",https://placekitten.com/1015/142,1783.8,False
101,b,in,Often operation which position. Blue animal oil. Very cell seem these trade go sister.,https://www.lorempixel.com/272/505,2423.07,True
102,e,try,"Majority dark house stand food none. Political forget call she space discuss.
Believe serious outside music even. Type country here thought themselves similar arrive.",https://placekitten.com/703/475,67.65,True
103,e,high,"Concern bill serve. Plant anything necessary like room.
Hand the minute white.
Son prove rule go listen. Person simple job fast. Try later sound thought recognize already.",https://placekitten.com/485/74,1432.04,True
104,d,there,"Collection share after fine stop.
Too bag human star season wish everything. Home ask road specific stuff chair.
Go social Republican stand woman. School throughout medical story.",https://placekitten.com/753/749,1785.2,False
105,c,option,"Interview must police section. Thought without central life establish.
Somebody rule even debate natural body. Then wind every sit involve nor behavior sure.",https://placeimg.com/141/19/any,2237.24,False
106,a,yeah,"Tend easy plant option. Themselves significant east.
World reach cultural ten very this. Deal window me each everything industry notice.
And tax read sit. Himself management discover.",https://www.lorempixel.com/943/315,2685.62,True
107,a,newspaper,Present partner my short resource ability above. Actually though likely dream water stock. Tree body national its plan.,https://placekitten.com/254/188,1988.01,False
108,d,past,"Phone feeling go prove what vote prove. Cultural billion apply end too practice.
School clearly throw expert you past. Gas to maybe. Beautiful might point budget exactly trip should.",https://placeimg.com/462/432/any,2964.19,False
109,f,grow,Fish win light southern. Decide Republican large about house put. Rest explain phone case every movie pattern for.,https://placekitten.com/470/1017,2626.62,False
110,a,often,"Enjoy practice above reason. Time ask imagine ok kitchen evidence machine.
Around stuff brother in. Happen enter seven key. Happen however number six business per art.",https://www.lorempixel.com/630/913,2595.08,True
111,e,school,"Home rest PM just dream. Drive because heart describe.
Cup blood admit cultural result. Floor I whose. Minute threat real address year agent.",https://placekitten.com/40/903,2785.01,True
112,e,themselves,"Peace positive trouble husband several. Rule baby land difficult relationship piece me.
Per sing religious visit. Give respond federal pass bad spring at. Democratic head too best growth.",https://www.lorempixel.com/485/208,2958.15,False
113,a,important,Thought set lay possible condition material report company. Measure adult director land hope. World view picture for administration discussion nice. Even figure take boy.,https://www.lorempixel.com/66/158,96.89,True
114,c,suffer,"Whatever six several. Option summer change physical today five.
Identify continue staff first expert.",https://placekitten.com/42/5,1978.24,False
115,c,bag,"Society firm not wonder believe boy. Claim arm suddenly class expert nation only. Yet hard scientist.
Black than realize house drop. Each go simply sort.",https://placeimg.com/511/852/any,2966.54,False
116,d,hot,"Product good participant make son.
Forget animal will or certain. Specific force team read or through.",https://www.lorempixel.com/943/32,2430.87,False
117,e,plant,Affect executive material actually citizen. Worry quickly pretty choose. Three population value medical.,https://placekitten.com/825/86,933.76,True
118,d,early,Beat run course push feel girl. Treatment tell visit discussion notice tonight important trial. Want home pretty garden.,https://www.lorempixel.com/509/195,1818.83,False
119,a,Congress,"Light class which most memory. Claim already ok but tough.
Seek market kind must. Teacher decide force ready window record others right.",https://placekitten.com/59/100,2420.87,True
120,b,scientist,Herself low million value part back. Can account present more marriage.,https://placeimg.com/105/360/any,373.31,True
121,c,sing,"Analysis billion check southern. Choose style tend memory road. School often start compare bed drop loss.
Prepare impact executive glass new seat allow. Possible lawyer law.",https://placeimg.com/682/379/any,1362.16,True
122,a,call,"Part thousand serious fire man all care. Set student miss front send stage. Pull act itself civil forget score campaign.
Election suffer line analysis.",https://placekitten.com/226/710,1628.84,True
123,d,condition,"Tonight stand sure him order we life. Summer plant international responsibility PM can civil.
Message month win trouble director anyone. Risk another listen.",https://www.lorempixel.com/677/570,1161.38,True
124,b,realize,"Learn suddenly me conference everything night poor. Read laugh whom drop impact receive cell.
Vote authority point such voice hear. About skin collection color computer natural.",https://placekitten.com/923/403,1091.72,False
125,f,religious,"Course year receive act about set although if. House research sister line.
Article tree worry. Every produce every sure process amount.",https://placekitten.com/942/225,2542.85,False
126,c,various,"Yourself agency art own low million themselves yes. Office main those nor. Far probably American light.
Save suffer bar. Sell compare enjoy however concern part notice manage.",https://placekitten.com/382/617,2804.93,False
127,a,despite,"Event glass world style trial. Policy plant beautiful billion guess.
Art drive pass. Put although film or movie huge ready.",https://placeimg.com/132/379/any,2552.96,True
