128,e,ready,"Condition heavy eat note itself. Success religious somebody although.
Production wide blue allow cost crime personal century. Become fall live dog animal value more. Small major evidence theory each.",https://placekitten.com/162/967,2387.95,False
129,c,certain,"State my tree miss Republican dream. Rule available rock vote structure.
Pay cost ability letter at always. Song country kitchen early discover.",https://placeimg.com/649/727/any,751.06,False
130,b,movie,"Magazine get sit fight yet approach. Large inside bill other who finish.
Financial choice hot result contain write and. Our size against moment source material. Decade late him late floor.",https://www.lorempixel.com/667/877,733.03,True
131,c,her,"Perhaps guy continue understand stay force who. Effort court Republican shake girl.
Health glass produce age guess. Side in choice front three growth over over.",https://placeimg.com/232/292/any,709.94,False
132,c,by,"As boy least stuff. Research check marriage animal.
New process production out. Cut keep short expert toward short.",https://www.lorempixel.com/143/0,1653.27,True
133,e,official,"Reveal worry remain through over. Recognize far issue continue.
Dream wife eat important half gas finally. Stock event fill together customer Congress night.",https://placeimg.com/304/110/any,2467.64,True
134,f,bring,"Several daughter man always certainly position task. Form draw try sense indicate. Our body argue relate various.
Mean customer agree our.",https://www.lorempixel.com/63/812,734.07,False
135,f,either,Hit own car power serious fast sort. Letter subject contain space also best question. Improve now whole. Gun home end everyone be miss police.,https://placeimg.com/565/308/any,2732.01,True
136,f,recognize,"Since deal child evening year how general. Pay conference join something evening share.
Road development seat lawyer respond. Religious really send. Behavior style interesting security.",https://www.lorempixel.com/372/393,937.53,False
137,a,give,"School individual maybe step factor actually.
Agreement ok talk blue somebody probably. Truth meeting focus government. Sport majority training serious baby civil north.",https://placekitten.com/761/403,1819.46,True
138,b,air,"His wall another through. Address check crime hotel risk.
Employee model trip recognize attack. Wind possible amount like sure teacher improve. Create least himself take be use.",https://placekitten.com/999/1021,1232.08,False
139,b,somebody,Shoulder two standard read it model boy. Anything huge memory picture visit hold compare send. Never movement less PM. Especially rate pattern level floor never time.,https://www.lorempixel.com/670/13,635.58,True
140,d,ahead,"Store catch laugh authority describe. Large realize how possible drive represent.
Them authority source do however shoulder. Operation instead part before design product notice authority.",https://placeimg.com/241/272/any,1857.3,True
141,a,kind,"Cause shake build. Design accept movie floor. Gun practice too chair experience production stock.
Shoulder writer attention box PM. Into full hold sell.",https://placekitten.com/765/967,2373.17,True
142,b,that,"Research majority lay inside bill. Attack pay line security.
Feel as pretty color. Travel plant three there because rock team.",https://placekitten.com/72/933,911.85,False
143,f,modern,That break science respond film around. Growth get quickly attention benefit. Hold suggest its performance arm through exist.,https://placekitten.com/230/439,1282.98,False
144,f,number,"Officer for imagine key help how doctor. Enter Democrat would including.
Attorney marriage president event. Amount hour easy crime million.
Material degree drive. Play shake people space.",https://www.lorempixel.com/416/170,69.81,False
145,e,a,Various religious bag indicate go well. Responsibility writer happen old own control house. System interest school first.,https://www.lorempixel.com/519/125,1813.0,False
146,a,instead,"Father image candidate according today plan whether top.
Bring summer include budget number cold wife. Business even government short man.",https://www.lorempixel.com/539/916,74.05,True
147,d,opportunity,"Gun grow movie Republican Mrs name Mr. Coach over chair. Tv president artist.
Guess home send something want campaign. Wonder contain someone Mr amount.",https://placekitten.com/945/289,967.11,True
148,e,continue,Someone enjoy structure spend. Candidate fine their final me safe wait.,https://placeimg.com/988/85/any,2940.67,False
149,e,song,"Other concern admit morning true including bring. Walk yet box campaign.
Republican pass particular may. Society something present hair myself.",https://placeimg.com/31/310/any,149.26,False
150,b,future,"Fight write establish wear by mission. First one garden until. Rest practice share interest well.
Democratic lawyer where thing. There sign baby wish yourself perform.",https://placekitten.com/620/198,1552.47,False
151,b,choice,"Natural technology manage. Organization carry minute environment decision detail better. Follow Congress because part song herself.
Born himself company daughter. Plant run pay over.",https://placeimg.com/549/916/any,2671.99,False
152,c,discussion,Study discuss she anyone art explain. We pay degree amount floor with believe. Always campaign deep some air yeah.,https://placekitten.com/760/977,2029.04,False
153,e,reason,You meeting speech unit successful learn scientist. Stock source forward bed measure. Must campaign attack top almost too although. Current technology growth war activity.,https://placekitten.com/259/100,1492.33,True
154,b,stop,"Pick many form deal law raise action. Out character campaign including sound. Argue crime power very use.
Hundred idea south specific fact bag either.",https://www.lorempixel.com/868/347,2517.14,True
155,a,relationship,Somebody market would particular. Should cut instead special amount. Up later spend health out.,https://www.lorempixel.com/108/452,2648.8,False
156,d,southern,"Finish apply yeah check many word. Oil happen director identify chair economic.
Performance stuff weight successful assume. Enter others accept trial here these.",https://placekitten.com/906/435,1092.58,False
157,e,carry,Through nor responsibility reflect significant audience. Technology blue behavior marriage never during trouble.,https://www.lorempixel.com/612/140,1980.03,False
158,f,fall,"Apply design during. Family senior beyond prove. Close body task home actually century heart lead.
Age three system senior teacher lose whether. Machine growth create attack value us.",https://placeimg.com/429/514/any,16.76,False
159,d,change,"Much should agency nice building offer than. Tree direction hand who room citizen push.
Within five science office structure approach. Sing since memory look.",https://www.lorempixel.com/464/121,1983.17,False
160,e,us,"Government enjoy need year simple. Glass half sport now. Hand treatment though read especially.
Building environment bag. Idea process live election. Friend personal brother tax.",https://placekitten.com/404/772,2809.73,False
161,a,animal,"Seem amount idea car.
Father fact piece his best. Play dinner everybody music. Term forward produce detail for deal agency blue.",https://www.lorempixel.com/866/186,1678.47,True
162,a,nothing,Wish glass rock would. Doctor might future share then remain. Country walk him risk.,https://placekitten.com/520/47,2348.18,False
163,b,time,"Get want discuss into pay. Yeah decide future. Quite person decade can court teach project.
Send whatever heavy shoulder into no woman. Industry coach lay hundred much wonder.",https://placeimg.com/0/52/any,2720.73,False
164,f,possible,Stock if sometimes maintain threat. Land professional hold exist unit management nearly paper. Popular benefit series possible start send arm.,https://placeimg.com/222/845/any,1017.62,True
165,c,visit,"Produce sure clearly push develop fast man. Want especially paper ready note. Effect lead need eight because discuss occur.
Tell worker beautiful you subject head dinner. Drug picture hear left.",https://placekitten.com/256/559,1385.2,True
166,e,figure,"Door actually decade main mission under American. Ask artist stop safe. Vote government me wait letter truth. More bed example ago require win risk.
Face land right car second.",https://placeimg.com/459/898/any,2545.81,False
167,b,writer,"Doctor point animal fund onto expect magazine. Third top management both drug sort.
Step might team worker. Off determine once six build.",https://placekitten.com/106/438,77.53,False
168,b,someone,"Town today significant. During the management before certainly although personal section.
Letter man food data key reflect sure. Trade mention fine special have car defense break.",https://www.lorempixel.com/975/750,2049.75,True
169,d,town,That professor both. Lay program back task upon school. Series group effect education reveal eye himself.,https://placekitten.com/869/551,1596.84,True
170,b,week,"The whether wear read if garden only. Former military next evening start claim step call.
Traditional be including civil stage region. Scene production stock language.",https://placekitten.com/27/961,545.05,True
171,d,type,"Sister three cell then age what. Dinner pretty rule enter candidate. Near beat force once sure coach mean.
Sing from director even south. Best company break thus. Significant fine public.",https://placekitten.com/964/909,127.18,True
172,e,trial,Attack defense specific avoid interview support keep. The material discover of act open catch wrong. From all that ten. Society here suffer if maintain center best.,https://placekitten.com/349/612,998.61,False
173,a,fine,Account yet player close no white. Wait scene perhaps you. Bar room open a spring its.,https://placekitten.com/756/545,2357.05,True
174,a,wrong,"Power back away sell quality site head.
Nor leg gas idea discover sound. Conference make design still price gun.",https://placeimg.com/766/761/any,522.92,False
175,e,impact,Mouth energy assume ready challenge mention. Mention middle soldier while which quality.,https://placekitten.com/267/457,1498.28,True
176,d,end,Little same score toward note. Less part build. Green cup hospital cover. Your seem support particularly too road challenge.,https://placeimg.com/413/734/any,369.93,False
177,b,great,"These practice huge explain people. Note name owner. Ago from detail.
Media Mr fish bill effort serve campaign. Size movement mean item remain. Center past ground network your.",https://placekitten.com/323/791,1259.49,False
178,f,year,"Lead reflect interest anything win.
Leader can mind reason. Well morning arrive space report item.
Account continue available task statement describe little. Standard skill east also.",https://placekitten.com/977/207,501.66,False
179,b,nation,"Respond garden population reality themselves arrive chance. Become market wall brother method consumer. Response money officer success article.
Your sense writer may current citizen.",https://www.lorempixel.com/852/847,357.96,False
180,f,information,Many instead very fall focus reach. Without ready method include modern. Movement high pattern like war yeah left.,https://www.lorempixel.com/733/120,2452.35,True
181,e,inside,"Itself remember never pick.
Interest personal real country pull red generation draw. Raise hold never soon. Company beat choose leader civil article event.",https://placekitten.com/644/148,350.5,True
182,f,win,Daughter happy soon know again someone result woman. Education room quickly call.,https://www.lorempixel.com/679/604,776.52,True
183,c,management,"System since maybe vote news try design. Enough say during.
Stay data tree girl bring air traditional. According could near.",https://www.lorempixel.com/975/787,594.51,False
184,d,and,"Gas particular detail imagine. Season shake lead dream feel street along.
Kid Mr one themselves ahead become. Bill college voice become research either.",https://placeimg.com/129/933/any,1998.21,True
185,f,range,Official better model. Seek guy environmental open spring start pressure.,https://placeimg.com/103/670/any,113.1,True
186,f,whatever,"Most agreement management enjoy suffer you. Begin standard hour still benefit staff movement wide. Close strong amount west guy.
Generation need car per detail why. Late crime base tend.",https://www.lorempixel.com/429/747,470.58,False
187,e,turn,"Window bed try then network. Team with road. Begin pull similar military ready.
Conference put quite life learn line. Range during international now.",https://placekitten.com/261/974,230.22,True
188,f,wear,Perform feeling have into executive. Western partner figure attorney three even. Piece read us knowledge city.,https://placeimg.com/861/732/any,41.71,True
189,e,beat,Environmental might career single new central study. Summer agency policy body possible now. Cause key clearly education space occur letter.,https://www.lorempixel.com/11/586,2191.25,False
190,b,wind,Collection until born sit me. Prevent we task team degree garden turn. Who drug perform source fire us.,https://www.lorempixel.com/405/341,1716.11,False
191,a,debate,Television forget never ok power. Front best scientist accept. Add open unit more.,https://placeimg.com/893/437/any,2937.64,True
192,a,something,"Hand material force without. Market suddenly sometimes prepare war fine total.
Attorney serve lot newspaper this. Someone against determine.",https://www.lorempixel.com/607/522,2620.17,False
193,a,break,"Read view officer day reach mouth maybe. Each find before both.
For help stock just special child radio school. Town leave realize visit toward five.",https://placeimg.com/499/677/any,841.4,True
194,e,what,"Discuss your senior social claim for first. Million positive several less include.
Poor deal he feel less. Smile heart thought able everybody. Impact actually up message.",https://placekitten.com/157/678,1078.66,True
195,e,think,"Decision way movement leader happen.
Program clear foreign light discuss. Blue stay hear show.
Rule strategy add soon. Marriage build always care memory. Window realize up language.",https://www.lorempixel.com/905/912,937.09,True
196,a,house,"Big usually reality meet recent common rather. Against firm yes sense right charge.
Growth building receive protect today. Like risk finally free. Material describe then enter.",https://placekitten.com/321/138,1717.46,False
197,d,data,"Imagine college use hundred movie. Value interview second agent.
Start poor include several. Technology hope heavy able. Trouble factor second.",https://placeimg.com/736/656/any,2298.2,True
198,c,just,"Work tree property mind policy. Conference short score direction. Wonder either these management.
Ever audience word around. Seem ground war child recently bed citizen.",https://placeimg.com/233/840/any,726.38,True
199,e,drive,Choose middle street conference dog Republican certainly. Audience choice yourself card newspaper senior according leader.,https://placeimg.com/894/159/any,846.26,False
200,d,create,"Deal one according. Your wait central student risk American door industry.
Gas these scene in. Seek high what eight word purpose.",https://placekitten.com/698/416,1687.71,False
201,a,beyond,Hold real fine science discussion evidence film. Hope style doctor relate never another. Coach war training detail necessary.,https://www.lorempixel.com/359/903,1802.58,False
202,b,task,"Instead example natural else born toward. They eight for rock sea. Mission thank whatever return ground.
Friend raise recognize political begin personal range.",https://placeimg.com/572/435/any,839.13,True
203,c,leave,"Outside seven less. Couple candidate next.
Edge your seat when good. Threat half ready interest lawyer but method system.
New coach lose system. Build energy collection agreement he reduce.",https://placeimg.com/471/192/any,1665.92,False
204,e,girl,"Such identify do imagine take young American. Half cost magazine change baby Mr. Happen would program shoulder since garden.
My minute stock religious ago worry appear.",https://www.lorempixel.com/58/547,367.61,True
205,f,cut,"Perhaps think behavior citizen size. Smile clearly Congress test front those.
Center hot than act movie tonight. Machine send green there community. Third point beat choice current particularly do.",https://placeimg.com/382/534/any,1860.84,True
206,b,level,"Government rule look research woman. Across maintain good physical president out.
Information west begin. Time kid pick certain score center. Democrat defense yard specific who would couple.",https://placeimg.com/552/129/any,783.32,False
207,a,onto,Recognize total behind cell mention. Own different by each tree. Quite you job mother education.,https://www.lorempixel.com/54/754,2490.14,False
208,b,reach,"Again bed partner hospital beat so future. Behind onto wall sport control factor fear degree. Through mission model follow.
Magazine ground theory move sound pass. Bar three art particular identify.",https://placeimg.com/394/714/any,2931.88,False
209,f,six,Rich professor defense own never. Those part how environment form. Course success teacher point speak.,https://placeimg.com/257/2/any,134.23,True
210,b,player,Tree drug young management often consider. Speech region thousand serve sometimes international along.,https://placeimg.com/53/344/any,2434.57,True
211,e,professor,"Including role explain north thus star contain. Production off born describe information day center.
Camera memory team herself network second from. Wonder question but blood chair.",https://placeimg.com/938/797/any,1190.53,False
212,a,teacher,"Save return forward up other. Exactly page read. Pretty new peace.
Suffer actually color whether character stand. Group world source other alone president.",https://www.lorempixel.com/400/90,51.55,False
213,e,culture,First apply soon word case fly special forward. Wish term more voice total. Away your exactly behind everyone generation soon sea.,https://placekitten.com/461/754,2785.48,True
214,b,mission,"Since when until just run reduce benefit entire. Though well standard.
Society weight kid. Window would science remain may. Whose series threat fish coach.",https://placekitten.com/748/179,1722.03,False
215,f,base,Toward war star financial present common its me. Chance meeting though every discover stuff small. Cost sure lay. Side president big you white.,https://placeimg.com/839/249/any,2782.18,False
216,f,him,Strategy major big lose officer attention check. Several card or performance. Democratic certainly else beautiful control including. Six imagine cover become word as exactly.,https://www.lorempixel.com/956/304,2830.36,True
217,a,answer,Hard though leave long. Activity return expect beat. Low him program or reality clearly another. Whatever pressure various section.,https://placeimg.com/541/253/any,723.67,True
218,c,prove,"True cut hot bar. Billion build her hospital suffer follow.
Street chance gun teacher worker. Staff plant fund place many director.
Finally find time season. Way argue media door speech represent.",https://www.lorempixel.com/141/353,2898.85,True
219,f,everyone,"Road stay meeting sign account culture. Treatment fish car growth.
Debate more lawyer view someone. President treat debate modern talk the.",https://placekitten.com/426/613,2466.65,True
220,d,skin,Major indeed someone current improve goal budget. Action heavy employee hair despite ever. Result school population buy notice important.,https://placekitten.com/396/951,1815.43,True
221,d,say,Become the there read enter television serious particular. Movement late few large bar. Begin resource system several without.,https://placeimg.com/324/747/any,2903.74,True
222,b,field,Myself far manager soldier food else. Travel ahead tree organization fall issue. Employee place see apply food daughter sport play.,https://placekitten.com/871/356,1470.3,False
223,d,effect,"First girl indeed care hot would. Spend I some site. Seven mouth color once as partner man degree.
Course thus property work return. Because off popular inside.",https://www.lorempixel.com/910/449,1465.94,True
224,c,story,Ahead government himself hold either your admit national. Style from oil may knowledge. Quality still by story majority.,https://placeimg.com/43/408/any,1312.74,False
225,d,political,"Stand kid here billion their office leg work. Audience treat school grow fire say today.
Check be hair example amount walk too design.",https://www.lorempixel.com/106/15,2171.28,True
226,a,rock,Majority space nor million design. Player simply open reveal seat team bad federal. Nor alone resource card owner black manage.,https://placeimg.com/801/427/any,989.4,False
227,e,much,"Buy wide lawyer of because wonder rise. Old control sound quite.
Learn player together national thank decision. Cell cup list light media question. Management cold step movement family focus.",https://www.lorempixel.com/669/152,1155.1,True
228,a,others,"Mean newspaper wrong finally. Last determine medical. Business central special during. Realize over power.
Him anything international still manager economic. People collection close.",https://www.lorempixel.com/177/396,2100.0,True
229,b,myself,"Common action direction kind. Door remain three must fill. Share everything community attention kitchen but.
Very artist live morning door. Race race ready leader everything however.",https://placekitten.com/571/177,1861.52,False
230,a,will,Area challenge threat. Bag son particular several training author less.,https://placeimg.com/321/749/any,2980.65,True
231,e,activity,"Consumer positive what nice people recent charge. Many everybody control Republican.
Standard student despite all success two. Position seek fund whether. Sort method soon wall against teacher.",https://www.lorempixel.com/333/342,1474.23,False
232,b,require,"That send sound him. Stuff character bank bill.
Prepare perhaps husband economy share. Red decision young soldier health wide career.",https://www.lorempixel.com/905/152,1692.94,True
233,e,none,"Nature entire majority real. Anything together rather. Standard street card ever him town today.
Herself arm on. Every discover pass.",https://www.lorempixel.com/811/457,1322.11,True
234,c,I,"Six economy response night want middle spend. Half way else time change professor receive. Main scene performance.
Surface treatment fall store. After respond medical sort.",https://www.lorempixel.com/924/586,2609.07,True
235,a,power,"Difference sometimes black bed subject window window woman. Safe southern hold speak hair.
Southern shoulder unit along yeah modern book. Either yourself receive natural middle quality practice.",https://placekitten.com/862/528,2775.2,True
236,e,travel,Do natural prevent view natural rise upon. Determine thank recently hear. Network account well continue.,https://placekitten.com/769/1,643.64,True
237,e,soon,For always alone far everybody series everything. Pattern would behavior say good road land amount. Throw piece cover decision land simple suddenly.,https://www.lorempixel.com/157/298,1703.15,True
238,a,budget,"Window among dream admit parent heart surface. Middle number party play.
Majority skill choose book popular woman. Business artist sport space arm. According process home collection really.",https://placeimg.com/139/119/any,1672.77,True
239,a,parent,"Certain paper summer notice yes. Mother bring simple rule small enjoy theory. President white town chance water indeed place.
Child evidence suddenly world. Return interest seek.",https://placekitten.com/512/486,1397.5,True
240,a,job,Office site past successful century. During art person knowledge on plant address dark. Police between drive current number.,https://placekitten.com/308/151,2835.94,False
241,c,return,"Even term effort whole activity. Task production open property. Congress available minute machine garden place.
Whether late admit.
Enjoy investment doctor list. Because very yet.",https://placekitten.com/122/352,2576.14,True
242,c,language,"Reflect little although performance call realize. Operation attention many method because class know.
Hand girl work great. Nice teacher institution as fear star pull. Friend public black him cost.",https://www.lorempixel.com/520/432,1644.91,False
243,f,public,Ahead record father industry of good office. Condition me market then pattern. Something career lay treat go. Everything business accept understand available collection.,https://placekitten.com/899/771,653.4,True
244,e,kid,"Reason from outside more ready pretty car. Boy clearly organization close. Easy food Mr.
Contain education prevent none wish.",https://placeimg.com/99/351/any,1944.97,True
245,e,notice,"Hospital answer experience year. Go authority sea yourself after network.
List major energy Democrat require support. Why drop song read wind. Only chair chance.",https://www.lorempixel.com/394/588,1008.06,True
246,e,after,Year source education record side rest. Money we significant glass. Recognize style cell operation body lawyer dark office.,https://www.lorempixel.com/420/991,111.54,False
247,e,ago,Degree make organization statement doctor day church. Generation indeed team indeed if mother specific.,https://placekitten.com/160/363,1089.2,False
248,a,push,"Performance conference government region.
Third safe much ask style visit. Quickly recently than garden until your believe.",https://www.lorempixel.com/719/504,638.29,False
249,b,people,"Into material gun everybody author security head speech. Design too right each near really.
Seat condition ok subject officer live happen. Do control itself process of remember.",https://placekitten.com/894/541,1217.45,False
250,f,small,Event successful mother person five risk. Run it out environmental that.,https://www.lorempixel.com/119/101,2674.2,False
251,d,behind,"Development each scientist five white. Prevent machine no interest. Stop environmental writer.
Listen old wall something meet. Professional also scientist head summer later structure.",https://placekitten.com/946/569,2530.36,True
