252,f,skill,"Sure fish four forward investment coach deal.
Something no nothing two.
Summer keep race support force result. Administration possible thus value.",https://www.lorempixel.com/442/333,2123.75,True
253,e,business,Name nature road item hold consider. All offer career program mention lot inside.,https://placeimg.com/178/164/any,890.17,True
254,f,surface,"Front level indicate central research owner. Drop left compare yourself to. Degree blue represent exactly whose for onto.
Wish military site student. Person recognize along science.",https://www.lorempixel.com/179/888,1350.6,False
255,e,form,"Play your where opportunity. Thought key play shake. Despite realize suffer network their.
Everything enter cover organization those. Table tonight five agency black newspaper probably office.",https://www.lorempixel.com/858/89,2292.94,False
256,f,ask,She back teacher along might at type. These strategy senior dinner visit conference. Nor seek according water beyond. Check five prove.,https://placeimg.com/206/723/any,1270.17,True
257,c,rise,"Store interview wonder color citizen significant. Member social beautiful long bed yes.
Face both research common. Weight shake site situation.
Foreign risk class. Both collection together step.",https://placekitten.com/426/231,2303.71,True
258,f,letter,"Law discuss happen. People cold air control box.
Skin response fight open build adult federal. To big of health often street story. Fight break opportunity carry.",https://placeimg.com/819/118/any,1949.21,True
259,a,author,Local amount ground member capital national. Behind carry although challenge. No effort lay product president necessary poor. Go choose avoid try forget Congress meeting.,https://www.lorempixel.com/377/549,2513.32,True
260,d,out,"Will medical area. Compare now always. Behavior life knowledge light face last.
Maybe enjoy themselves interesting Mr loss old. Into around line require.",https://placeimg.com/740/869/any,1377.41,False
261,c,when,"Forward job democratic. Leader bar history enjoy.
Structure rather amount able easy later top.",https://placeimg.com/924/568/any,1443.42,True
262,b,speak,Poor approach student perhaps since should. Question game government pretty last. Itself Congress so statement prevent his size.,https://www.lorempixel.com/237/666,1645.46,True
263,e,project,"Camera truth collection strong successful option. Crime else wind.
Provide travel daughter she response into. Media rest despite really throughout.
Current wait southern speak.",https://placeimg.com/453/643/any,2867.89,True
264,a,fill,"Build measure ahead born admit card. Measure well upon consumer. Nearly blue look.
Blue identify stuff nation receive. Investment political huge offer. Physical short edge language policy.",https://placekitten.com/681/463,2406.91,False
265,f,art,"Blue picture series none.
Service bed writer glass. Great then dark mention authority ask various guy. Able by consider participant doctor nice money free. Against account region their medical.",https://www.lorempixel.com/269/226,66.98,True
266,e,fight,"Play effect several. Better economy detail loss respond best represent.
Wife understand PM early present politics. Voice form nation spring.",https://placekitten.com/58/662,413.75,True
267,d,offer,Seek other high share father once. Travel however western list affect PM. Price manager cup former better action lawyer. Environment benefit bring machine physical.,https://placeimg.com/309/912/any,679.24,False
268,d,nature,"Very charge however investment hundred point big.
Describe forget tend increase campaign tough task. Both particularly bit guy.",https://placekitten.com/361/255,2805.04,True
269,a,pass,"Feel charge production.
Vote management skin make window usually cup. Leave watch artist size.
Value choice about hard question. Various power easy another agree everyone.",https://placekitten.com/656/87,2760.98,False
270,b,not,"My area economic. Check small middle by.
Class million during upon. Card scene provide. Husband song toward.",https://placeimg.com/920/128/any,147.07,True
271,c,research,"Effort rich through.
Our grow within middle leave. Once seem parent stop religious main total put.",https://placekitten.com/24/557,1222.89,False
272,b,poor,Continue organization argue eye right. Care among possible fight this raise reveal. Rest federal specific serve in interview animal.,https://www.lorempixel.com/654/491,2903.39,False
273,e,star,"Manage in force do money suddenly strategy. Memory almost throughout both.
Nor success know others world seven memory. Pm window fact road some true.
Smile might affect well thought.",https://placeimg.com/876/782/any,1845.93,True
274,f,or,Upon letter air son. Movement how senior.,https://placeimg.com/562/42/any,1862.56,True
275,f,until,"Cell main find truth assume. What often east they travel.
Arrive spring window audience still. Pretty deep bank window try.",https://www.lorempixel.com/830/892,699.02,False
276,b,mean,Section cover yeah without including treat government. Hit than successful consumer food crime your. Though partner south of seat.,https://placeimg.com/98/113/any,385.6,False
277,a,TV,Cup so arm might dinner. Teach position simply hope than hospital clear. Finally their finally old.,https://placeimg.com/649/655/any,666.12,False
278,d,garden,"Alone note since prove. Send avoid all necessary. Themselves member sea bank summer.
Week fly remember them none. Past on computer hear side. Drug stock bit political discover budget.",https://placeimg.com/626/905/any,1770.63,False
279,c,century,Writer subject outside throw forward we. International south man though land run. Although some become could hundred purpose game.,https://placeimg.com/415/36/any,2052.18,False
280,d,test,"Ability car her within here line accept. Organization you plan road small traditional. Military live teacher approach true.
Interesting me either how. There trouble affect make.",https://www.lorempixel.com/664/639,497.59,False
281,f,fact,"Fly human on career into analysis although fall. South lose land article.
Face nearly this body condition. Until hand deal peace example specific. Leg thank teacher too offer woman community.",https://placekitten.com/271/483,2393.04,False
282,f,front,Manager along from current born successful. Stand almost single stuff play food his.,https://placekitten.com/835/719,2696.6,False
283,d,technology,Without study place whatever inside standard. Large cell outside raise. The worry piece rate society.,https://placekitten.com/840/464,1609.14,False
284,d,me,"Lawyer song enter. Individual campaign area financial.
Worker eight respond church respond. Appear name beautiful garden officer eight Republican teach.",https://placeimg.com/17/458/any,576.53,False
285,a,sense,"Congress sea quite. Include happy adult.
Only apply just positive important. There might save. Sure himself bank hotel poor.",https://www.lorempixel.com/385/490,870.41,True
286,b,water,Music present research ground information. Collection dream last which detail fear. Station yes news condition mean. Run image individual.,https://placeimg.com/642/329/any,1345.06,True
287,f,police,"Represent still event time day industry.
Process indicate because physical. It already behavior easy sometimes.",https://placeimg.com/128/750/any,1343.26,True
288,c,country,Ever several goal light himself control policy. Toward home gas Mrs class. Throughout kitchen understand live thought dream choose.,https://placeimg.com/889/666/any,1699.3,True
289,d,stay,"Price tend audience teacher rock approach show. Smile whom figure practice example eight small.
Arm cell take drive any front now most. Food team improve however film vote.",https://placeimg.com/795/666/any,1657.18,True
290,a,responsibility,"Wife lawyer already woman artist stage. Food popular example wind.
Opportunity their fine I. Power condition field. Community through same wonder time himself allow.",https://placeimg.com/738/187/any,2053.63,False
291,a,up,During everyone simple travel father company phone. Decision two sea report. Could lead design commercial.,https://www.lorempixel.com/514/684,970.77,False
292,e,according,"Life real couple sign become ready. Civil themselves contain control art person beyond factor. Foot himself pressure.
Itself goal spend onto treat live. Inside section man skin.",https://www.lorempixel.com/481/257,1359.5,False
293,b,finally,Nothing everybody professor produce left right. Point school bring record everybody present move. Score drop center keep.,https://placeimg.com/594/431/any,1098.93,True
294,e,PM,"Dream affect until stuff data friend pick. Experience individual challenge rock mind relationship. Son can turn.
Campaign require conference audience worry hour them. Leave him team not how.",https://www.lorempixel.com/785/24,2660.27,True
295,d,bill,"Think though girl speech. Between meeting word sell boy dream mother.
Federal everybody budget may. Table attention around. Writer question heart person.",https://placeimg.com/758/132/any,1348.62,True
296,c,case,"For relate civil. Deal ok beautiful same its lay can. Professor region education training leg affect put.
No with skin paper peace million computer. Artist resource hard explain everybody.",https://placekitten.com/244/374,1144.27,True
297,d,financial,Phone fine hand suddenly ball share. Industry professor their election difficult. Imagine page yes recent character wall newspaper.,https://www.lorempixel.com/10/262,1098.49,False
298,e,likely,"Information administration newspaper beautiful under if perform sometimes.
Reality clear role poor. Everything pass attack course him TV. Dog gun now pick understand.",https://placekitten.com/441/263,62.77,False
299,b,may,Paper young civil rock short despite. Tonight letter police air.,https://placeimg.com/57/239/any,1972.93,True
300,f,agreement,"Knowledge defense matter. Eat leg idea.
Federal spend standard hard role deal right. Born their join another thing which. Southern easy voice level.",https://placekitten.com/638/1003,2203.77,True
301,b,yourself,Skin test across friend. Medical serve represent agree. Loss share training tell.,https://www.lorempixel.com/315/483,1961.94,False
302,c,throughout,Show nation friend kind girl. Without wall myself girl western sister. Left animal attorney wide nothing research.,https://www.lorempixel.com/453/836,1863.51,False
303,d,sport,"Yes practice teacher husband. General picture use response alone game everybody finally.
High language character hold media reason general degree. Cultural believe become stage month.",https://placeimg.com/255/871/any,2785.59,False
304,d,young,Enough firm really it. Particular eat since young knowledge kitchen fine. Partner performance send name expect federal pattern. Major think participant nice thus.,https://placekitten.com/969/645,2345.95,True
305,d,size,Group sit lose environment. Nation thus week property. Material fly need difference generation prepare rate.,https://www.lorempixel.com/820/96,2711.03,False
306,e,lawyer,"Down perform board natural age.
Become follow trip animal. Beyond second continue president sell.",https://placekitten.com/642/631,538.12,False
307,b,herself,"Include first region charge condition onto. Better fund those across.
Ever play development window. Bank few north exist head. Government whom art each cause.",https://www.lorempixel.com/542/122,552.7,True
308,d,medical,"International realize east edge. Today character doctor financial buy.
Look fact chance. Get public child road though.",https://placeimg.com/125/850/any,841.17,False
309,a,per,"Thank against girl. Watch first idea thousand system. Ever outside thing hundred nothing type.
Citizen degree threat we main over. Such likely test light pass.
Only laugh two wonder consider nearly.",https://placeimg.com/925/413/any,415.34,True
310,f,brother,"Down situation artist body chair box. Front plant center talk.
Attorney result suggest new or campaign. May arm forward role right. Second future tough there down reality.",https://placeimg.com/824/32/any,1482.73,False
311,a,kitchen,Talk by yes color choice. Dream responsibility these material trade skin. Respond pull share third half expert.,https://www.lorempixel.com/879/653,567.63,False
312,d,wish,Could analysis these west operation. Successful reality risk writer quickly. Carry together consumer military state.,https://www.lorempixel.com/246/565,2011.08,True
313,e,production,"Professor employee action late. Generation allow young have group.
Century put until middle surface learn. My herself approach point really local. Section feel up claim tax.",https://www.lorempixel.com/701/314,1285.01,True
314,b,group,Job cold born perhaps car ahead its memory. One south score story travel himself all.,https://placeimg.com/258/245/any,695.92,False
315,d,the,"Population general address one fly later. Factor here measure air discuss purpose product. Situation until dog look.
Memory I food mean form. Road to happy exist often west thus.",https://placeimg.com/167/120/any,895.36,False
316,f,on,"Involve care travel purpose. She a executive food.
Bag member forget agree build argue. Avoid education success responsibility best financial body federal.",https://placekitten.com/41/419,1553.15,False
317,a,his,"Read central go ahead significant. Least car certainly billion this rate large.
Down deal race before million worry debate. Outside do them trouble remain. Up garden brother scientist left expect.",https://placekitten.com/757/758,1837.49,True
318,e,weight,With event along author remember ground. Turn close wish though performance or response we. Shoulder relationship become enough middle trial project.,https://placekitten.com/725/938,1980.73,True
319,e,indicate,"Choice race cup TV pull. Professor wish upon almost.
Class tell old sea information ok. Left economy clear.",https://placeimg.com/465/848/any,2649.62,False
320,c,science,"Including result reduce party. Type green contain experience.
Find fact suddenly only type station often she. Deep property live middle west. Trip today fact popular sport different.",https://placeimg.com/301/715/any,437.76,False
321,c,final,Firm foreign meeting game person big film. Usually impact state sister somebody admit day. Property professional dream paper office.,https://placekitten.com/684/775,2003.34,True
322,b,get,"Town half parent. Series case kid. Per just opportunity industry.
Special chair method seem sometimes represent. Entire so send nearly shoulder. Show end like carry cause.",https://placeimg.com/584/769/any,2645.03,True
323,f,audience,"Serve that before town everyone measure strong. School along ever. Wonder model career sure have half.
Never nearly decade soldier. Education itself order stock market off message.",https://placeimg.com/823/319/any,1005.89,False
324,d,respond,Evidence glass home lawyer nature. Claim cell news. She our season building former everybody movement.,https://placekitten.com/407/262,1240.75,True
325,c,little,Government common word and movie beat form important. Bed arrive push over last third. Stuff commercial decade way remember technology.,https://placekitten.com/504/808,1663.0,True
326,c,energy,"Return data meeting talk ground lead field finally. Still night citizen money me street teach. Miss economy source home.
Forget window school soon response little. State lay I role current.",https://placekitten.com/250/309,1002.52,False
327,b,point,Policy word daughter avoid consumer public lot. Lot trial activity gas class man good table. Eight determine away much hair claim. Process care education speech future service.,https://placeimg.com/107/519/any,1281.31,True
328,a,from,City great effect together PM material why country. Increase history which action professional. Degree power strong through second animal.,https://www.lorempixel.com/604/571,1556.58,False
329,b,city,"Magazine buy return house new now voice. Like left realize forget him measure exactly.
Itself off challenge share quite hard sit. Whatever third weight writer fly describe station.",https://placeimg.com/320/610/any,2800.46,True
330,f,western,Something rock real everybody no big opportunity interesting. Long successful or compare believe Democrat.,https://placekitten.com/62/354,2693.73,True
331,d,nice,"Hotel well everyone there machine. Fall study improve study lay machine cut.
Enjoy deep paper. Rich ball couple card feeling yes job. Employee brother pull send pick want available.",https://www.lorempixel.com/391/520,668.22,False
332,b,care,Staff section pay minute think write. Staff thus type area available people. Rather party research change later thank.,https://www.lorempixel.com/253/129,1791.26,True
333,c,machine,"Send customer society special. Those put prevent red describe billion. Clearly sit wish.
Attack woman shoulder. Money land pay yourself. Note it relationship.",https://placeimg.com/897/930/any,1248.6,True
334,c,cell,"Write without bit generation after. Memory something nor art hotel church. Event American baby method magazine great eat.
Sense woman art deep ready stuff surface. Three relate brother.",https://www.lorempixel.com/345/301,2378.67,False
335,b,deep,"Current green improve. Kid suggest man pay paper art.
Central two recent analysis off. Feel record page student.
Nature place answer candidate eye those.",https://placeimg.com/891/223/any,864.29,False
336,c,market,Congress character easy attack side watch able. Score some area fall glass kitchen sell. Pull especially number center total every lot commercial.,https://placekitten.com/135/573,2601.78,False
337,f,use,"Law name court here.
Size character tax spring ball nature training. Successful small eye leave. Want experience sister treat.
Kitchen performance city voice. Former clearly create.",https://www.lorempixel.com/945/405,1190.09,False
338,d,Democrat,Worry level new movie look view point. Avoid history project sing know central about. Exactly than debate woman through.,https://placeimg.com/275/515/any,1379.25,True
339,d,talk,"Throughout require show time who stop heart. Degree too certain politics his situation.
Both few eat. Process system almost group energy. Action know police throughout.",https://placekitten.com/136/315,1307.61,False
340,f,suggest,"Story through police white.
Mr arm whose operation PM. Middle production career pull side without. Team focus car right no them week style.",https://placeimg.com/89/423/any,309.81,False
341,a,marriage,"Throughout appear think up. Specific news couple most. Can lot anything least thank.
Rise unit another north bit tell. Physical open involve along bad remember point.",https://placekitten.com/858/29,77.45,False
342,c,bit,Attack animal even charge. Answer material explain into inside positive. First message want practice certainly drive Mrs.,https://placeimg.com/612/646/any,1649.41,False
343,f,television,"Stand message member across leave buy. Still until however itself listen yet foreign everything.
Miss also I outside story term else career. Role score rate agent computer many like.",https://placekitten.com/280/699,1319.14,True
344,a,pick,"Many member speech.
Wall body well. Consumer price throw meeting mother official develop. Follow school pay black matter. Yard grow realize turn.",https://placeimg.com/265/1001/any,2612.53,False
345,e,now,Evening Mrs leader PM. Media short seat analysis everybody appear these. Fight center peace myself blood itself improve.,https://placekitten.com/44/670,1184.12,True
346,d,he,Ready memory maybe brother relationship. Future firm remember pretty agreement. Term since its night speak. Until relate everybody long part cut.,https://placekitten.com/151/284,2833.96,True
347,f,class,"Top investment anyone impact five voice boy company.
Toward upon true. Say positive yes pick.
Doctor audience minute information tax movie whom. Direction alone community well hope require.",https://placekitten.com/5/990,926.32,False
348,b,total,Full election coach cause write develop. Daughter continue bring art risk class. Foreign tax stand man.,https://placekitten.com/183/614,2365.52,False
349,f,box,Mrs save specific project reach military. Dark son institution total social image method establish. Few lawyer draw later quite crime.,https://placeimg.com/1009/383/any,1732.02,True
350,d,color,"Commercial happy by his shoulder citizen. Exactly five upon figure. Nice society base.
Approach talk room behavior. Management set number camera again happen brother.",https://www.lorempixel.com/355/113,2120.91,True
351,e,situation,"Budget or risk usually president. Shake remain night data statement miss. Church trade general clearly. Manage officer nor.
Entire protect appear develop. Plant next serious window.",https://www.lorempixel.com/199/339,2110.68,False
352,c,fire,"Most course organization space else case describe. Surface stock interesting century more.
International mouth when blood more entire. Would first talk nature central those daughter.",https://placeimg.com/756/410/any,183.73,True
353,e,meeting,"Must simple big speak book wife catch father. Dream explain painting we they hear walk.
Group hour no send easy rest. Think still radio fight improve white democratic cost.",https://www.lorempixel.com/288/468,2515.15,False
354,d,recent,"Mr public a relationship health term. Six just really need ten.
Road there rest term now let discuss. Drive religious agree for want herself.
Memory institution join. Community ago return way up our.",https://www.lorempixel.com/63/152,1953.07,False
355,f,attorney,"Book sister rich good throw.
Group song local good similar Mr somebody. Catch might with minute reduce first.
Imagine talk born you order tree. Meeting age teacher.",https://placeimg.com/13/860/any,1636.28,True
356,c,board,"Pull international Mrs. Cut last moment discussion lead ever cold. Certainly society professional. Week produce allow.
Practice behavior half home race PM civil rise. Program few today next this.",https://www.lorempixel.com/176/817,584.96,False
357,e,coach,"His respond half cold.
Environment move treatment a hot star indeed. Decide anyone program remember little. Run century house future particularly.",https://placekitten.com/55/534,1324.53,True
358,d,about,Section window attack type wide base chair. Trouble least but charge choice actually figure song. Lead stuff brother war significant party necessary.,https://placekitten.com/29/27,653.84,False
359,b,interview,"Your trouble American management top drive. Then forward attorney.
Sing drug into door. Everybody stage authority and body stay.",https://placeimg.com/963/200/any,1154.79,True
360,e,tend,"Under environment my early much. Close wonder focus employee science.
Actually cup forget although report far democratic. Republican area customer expect however effect.",https://www.lorempixel.com/596/701,541.27,False
361,c,different,Education management what second media arrive force. Hospital across behavior build product find keep. Focus visit around push good great.,https://placeimg.com/933/558/any,857.73,True
362,b,campaign,Piece opportunity born history. Keep true party difference laugh each investment increase.,https://www.lorempixel.com/233/721,340.53,False
363,d,maintain,Study another participant her friend always. Traditional focus plan under form resource. Someone actually best life.,https://www.lorempixel.com/643/841,2544.12,True
364,c,rich,Cup box particularly site sell. Half quite garden idea. Seven detail window ready behavior staff ask.,https://placekitten.com/1013/872,758.8,True
365,f,far,"Power pass challenge think wide report carry. Same receive power little.
Prove director clearly benefit major how win. Box thus according build dinner. Good while wrong base when education star.",https://placeimg.com/815/640/any,1384.44,False
366,a,feel,"Feel wind over trouble various including. Star yard brother dream fast first.
Technology along fine house herself hold everything. We ability force third tonight early mean. Family clearly happen.",https://placeimg.com/87/844/any,637.83,True
367,e,sister,"President reflect method other above only keep over.
Left authority personal that rock marriage meeting fall. In give management. Real environmental focus most make industry hit.",https://placeimg.com/436/729/any,1032.01,True
368,a,part,"Strategy without continue standard. Ago quite price ground eat family claim.
Nearly new mission behavior market.
Nor energy direction his executive artist yeah. Though learn final issue interest leg.",https://placeimg.com/660/648/any,1789.96,True
369,e,find,"Child similar enjoy him move third billion. Son mean standard.
Least structure perform dark recognize. By defense peace seven doctor worker.
Current amount sometimes fact understand western I age.",https://www.lorempixel.com/481/947,1278.12,True
370,a,long,"Look seat consumer focus according. Nearly and similar eye letter hair list. Huge report relate apply clear method.
Miss go enjoy language not thing majority. Degree talk southern of.",https://placeimg.com/813/955/any,749.91,False
371,e,who,"Suffer whose until back customer food. Exactly charge agency you rest player per.
Almost interview structure skill. Here force artist behind half budget cold. Chair me teach.",https://www.lorempixel.com/282/756,2205.83,False
372,b,drug,Catch play young fall within author. Sound put color level board view drop. Arm wrong call challenge position heart interview. Manager success more trip reduce general child.,https://www.lorempixel.com/235/260,2792.14,True
373,c,hospital,Note form half ball about. Fire often everything change home compare. Join throw significant cause upon get.,https://placeimg.com/786/344/any,2327.64,False
374,e,economy,Style happen fear enjoy put way new sometimes. Director product list increase. Change realize interview price yet agent animal.,https://www.lorempixel.com/351/575,1335.61,True
