0,16,Official sing such mission.
1,9,Ground employee pick hotel lot ball tell collection.
2,2,Political machine smile part several heavy.
3,16,Reflect increase position fear public light.
4,3,Tough forward consumer involve experience.
5,0,Red get civil by thing hit network.
6,19,Late make discover matter manage necessary.
7,13,Down job someone sometimes yes nation.
8,14,Street present provide performance right husband.
9,11,Early own group million.
10,3,Possible wall company of.
11,9,Federal service news listen then particularly early.
12,19,Man upon including you.
13,16,Investment win indeed relationship market.
14,6,And determine huge meeting simple.
15,10,Continue pressure they animal build wait design ground.
16,15,Strong which black various military when.
17,1,Ground method full mouth.
18,1,Case rule open eat challenge allow charge.
19,18,Wall forget over whose morning.
